{
  "schema_version": "1.0",
  "analysis_level": "post_freeze_exploratory",
  "unit": "logical_application_bytes",
  "task_population": {
    "fresh_hard_math_v2": 300,
    "mmlu_pro_fresh_v2": 400
  },
  "dataset_weights": {
    "fresh_hard_math_v2": 0.5,
    "mmlu_pro_fresh_v2": 0.5
  },
  "group_reduction": "mean A/B within task; AO-SC8 uses one AB",
  "resource_vector": [
    "requested_solver_calls",
    "frozen_judge_input_plus_output_tokens"
  ],
  "serializer": "canonical UTF-8 JSON; declared raw, packetwise zlib9, or packetwise gzip9 mtime0; header per packet",
  "topology": "collaboration excludes queries; end-to-end multicast one query; unicast per dispatched solver",
  "packet_order": "ordered query dispatch, answer-prefix admission, then downstream transaction",
  "atomicity": "CL-RAT evidence + judge choice + committed output is one downstream transaction",
  "reserve": "provisional prefix-output capacity; equality fits; charged as traffic only on commit; exact frozen downstream profile",
  "nonfit": "stop at first nonfitting ordered packet; strict empty; partial resolves admitted prefix if commit fits",
  "delivery": "strict/partial use same attempted path; direct1_fallback is a separate profile-known preflight branch",
  "denominator": "all 700 planned tasks retained, including empty outputs; missing correctness is never zero-imputed",
  "uncertainty": "same-data grid descriptive; 156 contexts are not independent samples; original primary uses 10000 task-paired stratified bootstrap",
  "provenance": "Frozen original scores plus authenticated deterministic policy cache; see source release hash manifest. No new predictions or correctness labels.",
  "contexts": [
    [
      "collaboration_payload",
      832,
      "gzip9_per_packet_mtime0",
      0
    ],
    [
      "collaboration_payload",
      832,
      "gzip9_per_packet_mtime0",
      32
    ],
    [
      "collaboration_payload",
      832,
      "gzip9_per_packet_mtime0",
      64
    ],
    [
      "collaboration_payload",
      832,
      "gzip9_per_packet_mtime0",
      128
    ],
    [
      "collaboration_payload",
      832,
      "raw_utf8",
      0
    ],
    [
      "collaboration_payload",
      832,
      "raw_utf8",
      32
    ],
    [
      "collaboration_payload",
      832,
      "raw_utf8",
      64
    ],
    [
      "collaboration_payload",
      832,
      "raw_utf8",
      128
    ],
    [
      "collaboration_payload",
      832,
      "zlib9_per_packet",
      0
    ],
    [
      "collaboration_payload",
      832,
      "zlib9_per_packet",
      32
    ],
    [
      "collaboration_payload",
      832,
      "zlib9_per_packet",
      64
    ],
    [
      "collaboration_payload",
      832,
      "zlib9_per_packet",
      128
    ],
    [
      "collaboration_payload",
      1200,
      "gzip9_per_packet_mtime0",
      0
    ],
    [
      "collaboration_payload",
      1200,
      "gzip9_per_packet_mtime0",
      32
    ],
    [
      "collaboration_payload",
      1200,
      "gzip9_per_packet_mtime0",
      64
    ],
    [
      "collaboration_payload",
      1200,
      "gzip9_per_packet_mtime0",
      128
    ],
    [
      "collaboration_payload",
      1200,
      "raw_utf8",
      0
    ],
    [
      "collaboration_payload",
      1200,
      "raw_utf8",
      32
    ],
    [
      "collaboration_payload",
      1200,
      "raw_utf8",
      64
    ],
    [
      "collaboration_payload",
      1200,
      "raw_utf8",
      128
    ],
    [
      "collaboration_payload",
      1200,
      "zlib9_per_packet",
      0
    ],
    [
      "collaboration_payload",
      1200,
      "zlib9_per_packet",
      32
    ],
    [
      "collaboration_payload",
      1200,
      "zlib9_per_packet",
      64
    ],
    [
      "collaboration_payload",
      1200,
      "zlib9_per_packet",
      128
    ],
    [
      "collaboration_payload",
      2300,
      "gzip9_per_packet_mtime0",
      0
    ],
    [
      "collaboration_payload",
      2300,
      "gzip9_per_packet_mtime0",
      32
    ],
    [
      "collaboration_payload",
      2300,
      "gzip9_per_packet_mtime0",
      64
    ],
    [
      "collaboration_payload",
      2300,
      "gzip9_per_packet_mtime0",
      128
    ],
    [
      "collaboration_payload",
      2300,
      "raw_utf8",
      0
    ],
    [
      "collaboration_payload",
      2300,
      "raw_utf8",
      32
    ],
    [
      "collaboration_payload",
      2300,
      "raw_utf8",
      64
    ],
    [
      "collaboration_payload",
      2300,
      "raw_utf8",
      128
    ],
    [
      "collaboration_payload",
      2300,
      "zlib9_per_packet",
      0
    ],
    [
      "collaboration_payload",
      2300,
      "zlib9_per_packet",
      32
    ],
    [
      "collaboration_payload",
      2300,
      "zlib9_per_packet",
      64
    ],
    [
      "collaboration_payload",
      2300,
      "zlib9_per_packet",
      128
    ],
    [
      "end_to_end_multicast",
      1200,
      "gzip9_per_packet_mtime0",
      0
    ],
    [
      "end_to_end_multicast",
      1200,
      "gzip9_per_packet_mtime0",
      32
    ],
    [
      "end_to_end_multicast",
      1200,
      "gzip9_per_packet_mtime0",
      64
    ],
    [
      "end_to_end_multicast",
      1200,
      "gzip9_per_packet_mtime0",
      128
    ],
    [
      "end_to_end_multicast",
      1200,
      "raw_utf8",
      0
    ],
    [
      "end_to_end_multicast",
      1200,
      "raw_utf8",
      32
    ],
    [
      "end_to_end_multicast",
      1200,
      "raw_utf8",
      64
    ],
    [
      "end_to_end_multicast",
      1200,
      "raw_utf8",
      128
    ],
    [
      "end_to_end_multicast",
      1200,
      "zlib9_per_packet",
      0
    ],
    [
      "end_to_end_multicast",
      1200,
      "zlib9_per_packet",
      32
    ],
    [
      "end_to_end_multicast",
      1200,
      "zlib9_per_packet",
      64
    ],
    [
      "end_to_end_multicast",
      1200,
      "zlib9_per_packet",
      128
    ],
    [
      "end_to_end_multicast",
      2300,
      "gzip9_per_packet_mtime0",
      0
    ],
    [
      "end_to_end_multicast",
      2300,
      "gzip9_per_packet_mtime0",
      32
    ],
    [
      "end_to_end_multicast",
      2300,
      "gzip9_per_packet_mtime0",
      64
    ],
    [
      "end_to_end_multicast",
      2300,
      "gzip9_per_packet_mtime0",
      128
    ],
    [
      "end_to_end_multicast",
      2300,
      "raw_utf8",
      0
    ],
    [
      "end_to_end_multicast",
      2300,
      "raw_utf8",
      32
    ],
    [
      "end_to_end_multicast",
      2300,
      "raw_utf8",
      64
    ],
    [
      "end_to_end_multicast",
      2300,
      "raw_utf8",
      128
    ],
    [
      "end_to_end_multicast",
      2300,
      "zlib9_per_packet",
      0
    ],
    [
      "end_to_end_multicast",
      2300,
      "zlib9_per_packet",
      32
    ],
    [
      "end_to_end_multicast",
      2300,
      "zlib9_per_packet",
      64
    ],
    [
      "end_to_end_multicast",
      2300,
      "zlib9_per_packet",
      128
    ],
    [
      "end_to_end_multicast",
      4600,
      "gzip9_per_packet_mtime0",
      0
    ],
    [
      "end_to_end_multicast",
      4600,
      "gzip9_per_packet_mtime0",
      32
    ],
    [
      "end_to_end_multicast",
      4600,
      "gzip9_per_packet_mtime0",
      64
    ],
    [
      "end_to_end_multicast",
      4600,
      "gzip9_per_packet_mtime0",
      128
    ],
    [
      "end_to_end_multicast",
      4600,
      "raw_utf8",
      0
    ],
    [
      "end_to_end_multicast",
      4600,
      "raw_utf8",
      32
    ],
    [
      "end_to_end_multicast",
      4600,
      "raw_utf8",
      64
    ],
    [
      "end_to_end_multicast",
      4600,
      "raw_utf8",
      128
    ],
    [
      "end_to_end_multicast",
      4600,
      "zlib9_per_packet",
      0
    ],
    [
      "end_to_end_multicast",
      4600,
      "zlib9_per_packet",
      32
    ],
    [
      "end_to_end_multicast",
      4600,
      "zlib9_per_packet",
      64
    ],
    [
      "end_to_end_multicast",
      4600,
      "zlib9_per_packet",
      128
    ],
    [
      "end_to_end_multicast",
      9200,
      "gzip9_per_packet_mtime0",
      0
    ],
    [
      "end_to_end_multicast",
      9200,
      "gzip9_per_packet_mtime0",
      32
    ],
    [
      "end_to_end_multicast",
      9200,
      "gzip9_per_packet_mtime0",
      64
    ],
    [
      "end_to_end_multicast",
      9200,
      "gzip9_per_packet_mtime0",
      128
    ],
    [
      "end_to_end_multicast",
      9200,
      "raw_utf8",
      0
    ],
    [
      "end_to_end_multicast",
      9200,
      "raw_utf8",
      32
    ],
    [
      "end_to_end_multicast",
      9200,
      "raw_utf8",
      64
    ],
    [
      "end_to_end_multicast",
      9200,
      "raw_utf8",
      128
    ],
    [
      "end_to_end_multicast",
      9200,
      "zlib9_per_packet",
      0
    ],
    [
      "end_to_end_multicast",
      9200,
      "zlib9_per_packet",
      32
    ],
    [
      "end_to_end_multicast",
      9200,
      "zlib9_per_packet",
      64
    ],
    [
      "end_to_end_multicast",
      9200,
      "zlib9_per_packet",
      128
    ],
    [
      "end_to_end_multicast",
      18400,
      "gzip9_per_packet_mtime0",
      0
    ],
    [
      "end_to_end_multicast",
      18400,
      "gzip9_per_packet_mtime0",
      32
    ],
    [
      "end_to_end_multicast",
      18400,
      "gzip9_per_packet_mtime0",
      64
    ],
    [
      "end_to_end_multicast",
      18400,
      "gzip9_per_packet_mtime0",
      128
    ],
    [
      "end_to_end_multicast",
      18400,
      "raw_utf8",
      0
    ],
    [
      "end_to_end_multicast",
      18400,
      "raw_utf8",
      32
    ],
    [
      "end_to_end_multicast",
      18400,
      "raw_utf8",
      64
    ],
    [
      "end_to_end_multicast",
      18400,
      "raw_utf8",
      128
    ],
    [